Журналист Мумин Шакиров организовал для сестер Евгении и Ксении Каратыгиных, заявивших в развлекательном шоу на Муз-ТВ, что Холокост — это клей для обоев, экскурсию в концентрационный лагерь Освенцим. Репортаж о поездке в Освенцим был опубликован Шакировым на сайте издания «Совершенно секретно» 28 января. Сестры-близнецы Евгения и Ксения Каратыгины стали известны после выпуска программы «Безумно красивые» на Муз-ТВ, вышедшем в декабре 2011 года. Отвечая на вопрос ведущей Ольги Шелест «Что такое Холокост?» девушки заявили, что им это ни о чем не говорит и предположили, что Холокост — это клей для обоев. Выложенный на YouTube ролик с их ответом набрал около 300 тысяч просмотров и стал причиной бурной дискуссии в интернете о необразованности современной молодежи. Через три месяца после скандального выпуска программы, в марте 2012 года, журналист Мумин Шакиров пригласил сестер Каратыгиных в эфир на «Радио Свобода». Еще одним гостем программы была председатель фонда «Холокост» Алла Гербер. Повторно отвечая на вопрос, что такое Холокост, Каратыгины заявили, что это «гонение евреев во время Великой Отечественной войны». На вопрос «Что такое Освенцим», одна из сестер ответила, что это «что-то про войну какую-то гражданскую». В октябре 2012 года Шакиров организовал для Евгении и Ксении Каратыгиных поездку в Польшу, в концлагерь Освенцим. Для сестер, приехавших в Москву из Владимирской области, это был первый выезд за границу. Каратыгиным провели экскурсию по музею в Освенциме, а также показали советский фильм «Освобождение Аушвица», снятый вскоре после окончания войны. Поездка была организована при помощи Польского культурного центра в Москве. Во время экскурсии и просмотра фильма оператор, сопровождавший Шакирова, снимал реакцию девушек. «Побывав здесь, волей-неволей мы оказались в числе тех, кто об этом узнал, — цитирует журналист впечатления Ксении Каратыгиной от поездки. — Стыдно, что такое событие было масштабно, занимало этап в истории, советские войска приняли участие в освобождении узников, а мы об этом не знали». По итогам поездки Каратыгиных в Освенцим Мумин Шакиров планирует выпустить документальный фильм под рабочим названием «Холокост — клей для обоев?». Трейлер фильма был выложен на сайте «Совершенно секретно». Журналист и кинорежиссер Мумин Шакиров вел на «Радио Свобода» программу «Формула кино», теперь сотрудничает с газетой «Совершенно секретно», которую возглавляет бывший главный редактор сайта «Радио Свобода» Людмила Телень.	0
Директор радиостанции «Маяк» Сергей Курохтин покинул свой пост, сообщает в четверг, 31 января, «Интерфакс» со ссылкой на источник в ВГТРК. Теперь Курохтин займет должность первого замдиректора Дирекции радиовещания ВГТРК. По некоторым данным, директором радиостанции станет его заместитель Ольга Рыбина. Должность директора «Маяка» Курохтин занимал с 2004 года. Осенью 2012 года радиостанция оказалась в центре скандала из-за передачи о больных муковисцидозом (наследственное заболевание, которое поражает бронхолегочную систему, железы внешней секреции и органы желудочно-кишечного тракта). Ведущие рубрики «Болячки» Виктория Колосова и Алексей Веселкин позволили себе шутки по поводу внешнего вида больных, симптомов муковисцидоза и способов его лечения. Вскоре после выхода программы в ЖЖ появилось обращение к директору «Маяка» с требованием извиниться за поведение ведущих. В итоге Колосова и Веселкин были уволены, а их месячные зарплаты перечислили больным муковисцидозом. Извинения же за поведение ведущих принес программный директор «Маяка» Анатолий Кузичев.	0
Медиагруппа «ЖV!» Михаила Прохорова прекратила существование: проект «Сноб» и телеканал «ЖV!» станут отдельными проектами. Об этом сообщается в пресс-релизе «Сноб Медиа», поступившем в «Ленту.ру». Как объяснила генеральный директор «Сноб Медиа» Марина Геворкян, медиагруппа «ЖV!» изначально существовала просто как управляющая компания: «Она объединяла несколько разноплановых проектов, которые, будучи формально частью одного холдинга, с самого начала были самостоятельными и независимыми друг от друга, со своим вектором развития». В ходе реструктуризации, которая началась в холдинге, в «ЖV!» пришли к выводу, что оставшиеся в медиагруппе проект «Сноб» и телеканал «ЖV!» «более не нуждаются в отдельной управляющей структуре». Как объяснил «Газете.ру» Сергей Лаврухин, гендиректор холдинга РБК, еще одного медиаактива Прохорова, группа «ЖV!» с самого начала была «дорогостоящей историей с серьезным финансированием», однако в последние два года началось сокращение расходов. В феврале 2012 года президентом группы «ЖV!» и руководителем проекта «Сноб» был назначен бывший главный редактор журнала GQ Николай Усков. Тогда он заявлял, что поставленная перед ним цель создать успешную издательскую медиагруппу «абсолютно реализуема». Сейчас в ведении Ускова остался только проект «Сноб». В 2012 году из медиагруппы «ЖV!» вышли интернет-газета F5 и журнал «Русский пионер». В апреле главный редактор F5 Юрий Кацман выкупил газету у «ЖV!» в обмен на свою долю в медиагруппе. Летом выпуск газеты был приостановлен, Но Кацман заявлял, что собирается возродить бумажную версию издания уже в октябре 2012 года. В октябре, однако, газета выходить не начала, а сайт, который должен был работать в прежнем режиме, так и не обновлялся с июля. Журнал «Русский пионер» вышел из медиагруппы Прохорова в декабре 2012 года: издание Андрея Колесникова было выкуплено неназванными инвесторами. Медиагруппа «ЖV!» была основана компанией Михаила Прохорова «Онэксим» в 2008 году. Помимо «Сноба», F5 и «Русского пионера» в группу входил целый велнесс-проект «ЖV!», в который входили одноименные телеканал, сайт и клуб.	0
Руководство документального телеканала «24 Док» не продлило контракт с креативным продюсером Верой Кричевской. Об этом сама Кричевская сообщила «Ленте.ру». Вера Кричевская объяснила, что контракт с ней должен был быть продлен в январе 2013 года, и новость о том, что руководство телеканала отказывается от дальнейшего сотрудничества, была для нее неожиданной, поэтому она поинтересовалась причинами такого решения. Как рассказала «Ленте.ру» Кричевская,  по письменному поручению главы компании Александра Провоторова с ней встретился исполнительный директор «Ростелекома» Андрей Холодный. Компания «Ростелеком» владеет оператором «Национальные кабельные сети», которому, в свою очередь, принадлежит «24 Док». По словам Кричевской, ранее она ни с Холодным, ни с Провоторовым не встречалась. Как рассказала Вера Кричевская, у руководства «Ростелекома» нет претензий к результатам ее работы, более того, оно довольно развитием «24 Док». Говоря о причинах увольнения креативного продюсера, Андрей Холодный напомнил Кричевской о закрытии телеканала «Совершенно секретно», также принадлежавшего «Ростелекому». Официально преждевременное расторжение договора с «Совершенно секретно» объяснялось необходимостью оптимизировать расходы, однако сотрудники канала заявляли, что их эфир не устраивал «людей из администрации президента». По словам Кричевской, Холодный сообщил ей, что телеканал закрыли в связи с «идеологическими претензиями». Суть этих претензий Холодный «не разъяснил, потому что сами эти претензии, как и указания прекратить вещание канала, по его словам, исходили не от него, а от главы 'Ростелекома' Александра Провоторова и ’его непосредственного руководителя’». Исполнительный директор «Ростелекома» рассказал Кричевской, что с ней сложилась такая же ситуация. «В кулуарах политическая подоплека закрытия, по сути, канала ’Совершенно секретно’ обсуждалась, но это первый раз, когда это прозвучало официально, что, конечно, выводит ситуацию на новый уровень цинизма и безнаказанности, ну или, наоборот — открытости и прозрачности принятия решений», — заявила «Ленте.ру» Вера Кричевская. Она также добавила, что ей кажется важным упомянутый Холодным «непосредственный руководитель» главы «Ростелекома». «С одной стороны, я надеюсь, что ’руководителем’ госкомпании такого размера в области связи является отраслевой министр, с другой стороны, я не верю, что молодой и прогрессивный господин Никифоров будет закрывать телеканалы и ему есть дело до моей скромной персоны. Но может быть господин Провоторов подчиняется кому-то другому?», — предположила журналист. «Ленте.ру» пока не удалось связаться ни с пресс-секретарем Андрея Холодного в «Ростелекоме», ни с пресс-службой НКС. Кричевская пришла на «24 Док» в 2011 году и вместе с генеральным продюсером «НКС Медиа» Верой Оболонкиной готовила телеканал, созданный еще в 2005 году, к перезапуску. В декабре 2011 года обновленный «24 Док» вышел в эфир. Помимо постоянных рубрик «РоссияDOC», «ИноDOC», «АртDOC», «ЛюдиDOC», «ЭкоDOC» и «ПолитDOC» на телеканале появились спецпроекты, объединявшие несколько фильмов на схожую тематику. За год обновленный «24 Док» получил специальный приз «Открытие года» на телевизионной премии «Золотой луч», награду «Клуба телепрессы», а также был номинирован на премии «Сделано в России» и «Большая цифра». 1 февраля телеканал должен получить премию «Золотое перо». С 1997 по 2003 годы Вера Кричевская была ведущим режиссером и продюсером телеканала НТВ, автором проекта «Свобода слова». С 2008 года она участвовала в создании телеканала «Дождь», который запустился в апреле 2010 года. Согласно данным ЕГРЮЛ, Кричевская является одним из учредителей канала. Кричевская покинула «Дождь», где она занимала должность главного режиссера и креативного продюсера, в апреле 2011 года, после того, как гендиректор канала Наталья Синдеева сняла с эфира проект Дмитрия Быкова и Михаила Ефремова «Поэт и гражданин». Синдеева отказалась от проекта, сочтя, что шутки в адрес тогдашнего президента страны Дмитрия Медведева нарушили допустимые пределы. Проект под измененным названием «Гражданин Поэт» начал выходить на сайте газеты F5 и в эфире радиостанции «Эхо Москвы». В мае 2012 года Вера Кричевская представила документальный фильм «Гражданин поэт. Прогон года» о самом проекте и о его гастролях по России. В 2012 году Вера Кричевская также сотрудничала с журналом The New Times, в частности, готовила рекламную кампанию «Свобода слова.Дорого» к редизайну издания.	0
Ведущим австралийской радиостанции 2Day FM не будет предъявлено обвинений в связи с розыгрышем, который привел к самоубийству английской медсестры. Об этом 1 февраля сообщает BBC News со ссылкой на Королевскую службу по делам уголовного преследования (Crown Prosecution Service, CPS). Как заключили в CPS по итогам двухмесячного расследования, в действиях ведущих не обнаружено состава преступления, который позволил бы следствию обвинить их в гибели медсестры. В начале декабря 2012 года ведущие передачи Hot 30 Мел Грейг (Mel Greig) и Майкл Кристиан (Michael Christian) позвонили в лондонскую больницу, где находилась беременная Кейт Миддлтон, жена принца Уильяма. Дозвонившись до учреждения, они представились королевой Елизаветой II и ее мужем принцем Филипом и стали расспрашивать персонал о здоровье герцогини Кэтрин. На расспросы шутников ответила медсестра индийского происхождения Джасинтха Салданья (Jacintha Saldanha). Через несколько дней она покончила с собой. В результате скандала передачу Hot 30 закрыли, ведущих отстранили от эфира и отправили в отпуск (но не уволили). Компания Austereo Radio Network, которой принадлежит 2Day FM пообещала выплатить семье Салданьи компенсацию в размере 520 тысяч австралийских долларов, то есть около 500 тысяч долларов США, а также прекратила использовать в своих программах телефонные розыгрыши.	0
Украинский бизнесмен Валерий Хорошковский продал телеканал «Интер». Об этом 1 февраля сообщается на сайте телеканала. Как говорится в заявлении, Хорошковский продал 100 процентов акций компании Inter Media Group Limited компании GDF Media Limited, которая принадлежит украинскому бизнесмену Дмитрию Фирташу. Сумма сделки составила 2,5 миллиарда долларов. Говоря о причинах продажи Валерий Хорошковский заявил только, что «в сложившихся обстоятельствах не имеет возможности обеспечить развитие группы». Именно эти неназванные обстоятельства и заставили его продать холдинг. Вместе с каналом «Интер» под контроль медиа-холдинга Фирташа перешли и другие активы Inter Media Group: каналы НТН, К1, К2, МЕГА, «Энтер-фильм», и MTV. Предварительно сделка должна быть одобрена Антимонопольным комитетом Украины. Телеканал «Интер» начал работу в 1996 году. Вещание ведется на русском и украинском языках. По итогам 2012 года телеканал занял первое место на Украине по аудиториям 18+ и 18 — 54.	0
