Международный обозреватель «Коммерсантъ FM» Константин Эггерт опроверг информацию о назначении его главным редактором радиостанции. «Я не назначен главным редактором "Коммерсантъ FM"», — заявил Эггерт в комментарии «Ленте.ру». Ранее 4 марта телеканал «Дождь» со ссылкой на источник в радиостанции сообщил, что Эггерта назначили руководителем «Коммерсантъ FM». Аналогичная информация появилась в неофициальном микроблоге «Ъ FM». Днем 4 марта стало известно об увольнении главного редактора радиостанции Алексея Воробьева. Сам Воробьев, а также президент издательского дома «Коммерсантъ» Дмитрий Сергеев объясняли уход главреда личными причинами. Вместе с тем, бывший сотрудник радиостанции сообщил «Ленте.ру», что причиной увольнения Воробьева стало несогласие с редакционной политикой, проводимой владельцем ИД Алишером Усмановым. Источник «Дождя», сообщивший о назначении Эггерта, в свою очередь указывает в качестве причины увольнения конфликт Воробьева с редакционным директором и главным редактором газеты «Коммерсантъ» Михаилом Михайлиным. Сам Михайлин днем 4 марта заявил агентству «Интерфакс», что решение об увольнении Воробьева принималось «коллегиально менеджерами издательского дома», а Алишер Усманов узнал о нем последним. Алексей Воробьев возглавлял «Ъ FM» с августа 2012 года. Он сменил на этом посту Дмитрия Солопова, который ушел, чтобы сосредоточиться на собственном бизнесе.	0
Новым главным редактором «Коммерсантъ FM» стал международный обозреватель радиостанции Константин Эггерт. Об этом сообщает телеканал «Дождь» со ссылкой на анонимные источники в радиостанции. Вечером 4 марта о том, что главой «Ъ FM» станет Константин Эггерт, сообщалось в неофициальном микроблоге радиостанции. Тогда отмечалось, что информация основана на слухах. Официальных комментариев по поводу назначения главного редактора «Ъ FM» нет. Эггерт сменит Алексея Воробьева, уволившегося с поста руководителя радиостанции днем 4 марта. Как сообщил «Ленте.ру» бывший сотрудник «Коммерсантъ FM», Воробьев ушел из-за несогласия с принципами редакционной политики Алишера Усманова, владельца издательского дома «Коммерсантъ». Однако позднее и президент ИД «Ъ» Дмитрий Сергеев, и сам Алексей Воробьев подчеркнули, что уход вызван исключительно личными причинами. Воробьев подчеркивал, что радиостанцию возглавит один из его заместителей. На сайте «Ъ FM» указаны два заместителя главного редактора: Андрей Родионов и Олег Богданов.	0
Главный редактор радиостанции «Коммерсантъ FM» Алексей Воробьев покинул издательский дом. Об этом «Ленте.ру» сообщил один из бывших сотрудников «Коммерсантъ FM». Ранее об этом написали «Известия» со ссылкой на источники в холдинге. Источник «Ленты.ру» заявил, что уход Воробьева, как и все последние увольнения в ИД, был вызван несогласием с принципами редакционной политики Алишера Усманова, владельца «Ъ». Он отметил, что одним из последних поводов для конфликта стало интервью с бывшим мэром Москвы Юрием Лужковым. Интервью под заголовком «Юрий Лужков: "Сегодня я не вижу условий для политической деятельности"» было опубликовано в пятницу, 1 марта. «Ленте.ру» не удалось получить комментарий самого Воробьева. На радиостанции «Коммерсантъ FM» «Ленте.ру» заявили: «Сегодня без комментариев, пробуйте звонить завтра». Алексей Воробьев возглавил радиостанцию в августе 2012 года после ухода Дмитрия Солопова с должности главного редактора. До этого Воробьев являлся первым заместителем Солопова. В июле 2012 года Дмитрий Солопов заявил, что покидает радиостанцию, чтобы сосредоточиться на собственном бизнесе — рекламной группе «Идальго». Дмитрий Солопов работал на «Коммерсантъ FM» со времени основания радиостанции осенью 2009 года. В интервью «Ленте.ру» Солопов тогда говорил, что «обстановка, в которой сейчас существуют СМИ, очень сильно ухудшается». «Она будет ухудшаться и дальше, и мне не хочется тратить свое время на постоянный поиск компромиссов ради частичного исполнения профессии», — заметил он. Ранее 4 марта стало известно об увольнении Михаила Котова с должности главного редактора издания «Газета.ру». Кто займет его должность, пока не известно. За прошедшие полтора года в издательском доме «Коммерсантъ» произошло несколько крупных кадровых перестановок. В декабре 2011 года «Коммерсантъ» покинули главный редактор «Власти» Максим Ковальский, его заместитель Вероника Куцылло и генеральный директор «Коммерсантъ-Холдинга» Андрей Галиев. Летом 2012 года из «Коммерсанта» был уволен Демьян Кудрявцев, на тот момент занимавший пост Галиева. Новым генеральным директором «Коммерсанта» стал Павел Филенков. Новое руководство издательского дома приняло решение закрыть телеканал «Коммерсантъ ТВ» и журнал Citizen K. В связи с этим в медиасообществе циркулировали активные слухи о скорой продаже или закрытии радиостанции «Коммерсантъ FM».	0
Международный обозреватель «Коммерсантъ FM» Константин Эггерт назначен исполняющим обязанности главного редактора радиостанции. Об этом «Ленте.ру» заявил шеф-редактор «Коммерсантъ-Холдинга» и главный редактор газеты «Коммерсантъ» Михаил Михайлин. Сам Эггерт написал позже в твиттере, что приступает к работе с 11 марта. «Сегодня Константину Эггерту было сделано официальное предложение, и он его принял», — заявил Михайлин. Шеф-редактор холдинга пояснил, что Эггерт был назначен исполняющим обязанности руководителя радиостанции по правилам издательского дома. По истечении трех месяцев он вступит в должность главного редактора. Информация о том, что Константи Эггерт станет главным редактором «Коммерсантъ FM», появилась в некоторых СМИ вечером 4 марта. Однако сам журналист в комментарии «Ленте.ру» опроверг эти сведения. До работы на «Коммерсантъ FM» Эггерт являлся вице-президентом компании ExxonMobil Russia, а до этого на протяжении семи лет возглавлял московское бюро русской службы «Би-Би-Си» (октябрь 2002—февраль 2009). В 2008 году он был удостоен Ордена Британской империи. До «Би-Би-Си» Эггерт работал на радиостанции «Эхо Москвы», в газете «Известия». Днем 4 марта стало известно, что пост главного редактора «Коммерсантъ FM» покинет Алексей Воробьев. Сам Воробьев в интервью «Эху Москвы» заявил, что уходит по соглашению сторон, и что причины его отставки не связаны с редакционной деятельностью и редакционной политикой. Однако Михаил Михайлин отметил, что решение об увольнении Воробьева принималось «коллегиально менеджерами издательского дома». Источник телеканала «Дождь» назвал в качестве причины ухода конфликт Воробьева с Михайлиным. При этом бывший сотрудник «Коммерсантъ FM» сообщил «Ленте.ру», что Воробьев ушел из-за несогласия с принципами редакционной политики Алишера Усманова, владельца издательского дома «Коммерсантъ». За последние полгода радиостанция «Коммерсантъ FM» второй раз меняет главного редактора. В июле 2012 года о своем уходе объявил Дмитрий Солопов, решивший сосредоточиться на собственном рекламном бизнесе. Воробьев занял его должность в августе. 4 марта стало известно о еще одной громкой отставке в СМИ: Михаил Котов покинул должность главного редактора интернет-издания «Газеты.ру».	0
Новый проект Михаила Ефремова, Дмитрия Быкова и Андрея Васильева под названием «Господин хороший. Ньюзикл» будет выходить на телеканале «Дождь». Об этом сообщается на сайте «Дождя». Премьера состоится 11 марта в 22:30. Проект будет выходить в прямом эфире в формате итоговой программы. Авторы проекта будут обсуждать главные новости недели в разных жанрах: стихотворном, мультипликационном и частушечном. «Предполагается, что в ток-шоу "Господин хороший. Ньюзикл" ведущие будут обсуждать информационную картину недели со зрителями, не стесняясь в выражениях», — говорится в сообщении «Дождя». Зрители, к примеру, в каждом выпуске будут придумывать тему, на которую Дмитрий Быков в режиме реального времени должен сочинить стихотворение. На съемки передачи, которые будут проходить в московском клубе «Мастерская», каждый раз будут приглашаться специальные гости. Помимо Быкова, Ефремова и Васильева в работе над проектом принимают участие поэт Орлуша и рэпер Вася Обломов. Параллельно с трансляцией «Господина хорошего» на «Дожде» коллектив будет продолжать выступать с концертами. Премьера проекта состоялась 4 октября в Театре Эстрады. Предыдущий проект Быкова, Ефремова и Васильева под своим оригинальным названием «Поэт и гражданин» также изначально выходил на «Дожде». Премьера проекта, представлявшего собой злободневные пародии на известные стихотворения русских классиков, состоялась в феврале 2011 года. Уже в марте руководство «Дождя» сняло с эфира выпуск, в котором высмеивались разногласия внутри тандема Владимира Путина и Дмитрия Медведева. Тогда гендиректор «Дождя» Наталья Синдеева объяснила, что в эпизоде «есть фразы, которые способны обидеть не политика, а человека». После снятия проекта с эфира главный редактор и креативный продюсер «Дождя» Вера Кричевская уволилась. Права на проект выкупил бизнесмен Михаил Прохоров. Под новым названием «Гражданин поэт» сатирические выпуски стали выходить на портале F5, входившем в прохоровскую группу «ЖV!», и на радиостанции «Эхо Москвы». Проект был завершен 5 марта 2012 года, на следующий день после выборов президента РФ. В последнем выпуске прозвучала пародия на стихи Иосифа Сталина.	0
Корреспондентку колумбийского телеканала RCN Кармен Андреа Ренхифо (Carmen Andrea Rengifo) избили в центре Каракаса, когда она вела репортаж о смерти президента Венесуэлы Уго Чавеса. Об этом сообщается на сайте телеканала NTN 24. Кармен Андреа Ренхифо находилась вместе со своим оператором у военного госпиталя в Каракасе, где скончался Чавес. Как рассказала Ренхифо в интервью El Pais, когда она начала вести репортаж, кто-то из людей у больницы обратил на нее внимание и закричал, что она представляет "путчистский" канал, выступающий с критикой Чавеса. Несколько мужчин и женщин, стоявших вокруг, напали на журналистку и ее оператора, пытаясь избить их руками, палками и мотоциклетными шлемами. В эфир телеканала NTN 24 позже вышли кадры, на которых видно, как Кармен Андреа Ренхифо и ее оператор убегают от разъяренной толпы. По лицу Ренхифо при этом течет кровь. На видео корреспонденты RCN безрезультатно пытаются найти полицию, чтобы обратиться за помощью. В итоге журналистам помогли проезжавшие мимо мотоциклисты. Ренхифо прошла позже медицинское обследование, которое показало, что ее раны неглубокие. 58-летний Уго Чавес скончался в Каракасе 5 марта в 16:25 по местному времени. В 2011 году у него была обнаружена злокачественная опухоль, после этого он перенес несколько операций и прошел несколько курсов химиотерапии. Последняя операция Чавеса прошла на Кубе в декабре 2012 года. После этого у Чавеса начались осложнения, из-за которых он был вынужден оставаться в Гаване и даже пропустил собственную инаугурацию. Уго Чавес занимал пост президента Венесуэлы с 1999 года, последний раз был переизбран в октябре 2012 года. 	0
Компания «Би-Би-Си» вырезала из эфира несколько шуток шотландского комика Фрэнки Бойла (Frankie Boyle), в том числе, пассажи про смерть королевы Елизаветы II и беременность герцогини Кэмбриджской. Об этом сообщает The Independent. Фрэнки Бойл выступал на концерте «Give It Up for Comic Relief» («Бросай ради смеха»), посвященном борьбе с алкогольной и наркотической зависимостью. Трансляция концерта, состоявшегося вечером 6 марта, шла с двухчасовым запозданием в эфире телеканала BBC-3. В своем выступлении Бойл прокомментировал недавнюю госпитализацию британской королевы и заявил, что лучше бы Елизавета II умерла перед своим бриллиантовым юбилеем (60-летие царствования). «Я бы хотел, чтобы она умерла — они все равно не смогли бы об этом никому сказать, — пошутил Бойл. — Они бы были вынуждены впихнуть ее тело в костюм и заполнить его гелием». Комик также раскритиковал грудь супруги принца Уильяма Кейт Миддлтон и заявил, что удивлен, что та вообще забеременела: «Она сказала мне, что пьет чертовы противозачаточные». Как сообщает The Independent, в зале свистели после высказываний про королевскую семью, однако The Huffington Post отметил, что свиcт был скорее пародийным. Сам Бойл во время выступления даже заявил, что «Би-Би-Си» никогда не покажет этих шуток в трансляции. Помимо шуток про королеву и герцогиню Кэмбриджскую, из трансляции были также вырезаны шутки про покойного ведущего «Би-Би-Си» Джимми Сэвила, которого посмертно обвинили в педофилии, папу Римского и паралимпийца Оскара Писториуса, застрелившего собственную девушку. В компании «Би-Би-Си» заявили, что в полуторачасовую трансляцию просто не смогли войти все моменты с концерта, который длился три с половиной часа. Фрэнки Бойл, который также пишет колонки для британского таблоида The Sun, известен своими скандальными шутками. Ранее зрители не раз жаловались на него за шутки про раковых больных и аутистов.	0
Датский телевизионный канал TV2 по ошибке проиллюстрировал сообщение о ситуации в Сирии кадром из компьютерной игры. Об этом сообщает 10 марта Associated Press со ссылкой на официальное сообщение компании. Речь идет о выпуске новостей от 26 февраля. Изображение с видом Дамаска, послужившее фоном для ведущей новостей во время рассказа о ситуации в Сирии, вызвало бурное обсуждение в социальных сетях. Как выяснилось, сотрудник телеканала обнаружил изображение в интернете и принял его за настоящую фотографию. Иллюстрация была взята из компьютерной игры Assassin's Creed, вышедшей в 2007 году. На телеканале ошибку назвали «ужасной», а также заявили, что она «напоминает всем нам о том, как важно проверять происхождение иллюстраций».	0
