Журналистка Юлия Латынина извинилась за свою колонку «А какой бортовой номер был у метеорита?», в которой предположила, что над Челябинском взорвался не метеорит, а ракета. С этого она начала свою еженедельную авторскую программу на радио «Эхо Москвы» в субботу, 16 февраля. Латынина отметила, что ей «вообще надо молчать в тряпочку», обсуждая вопрос о том, почему метеорит заметили так поздно. Журналистка признала, что поторопилась с выводами. По ее словам, когда появилась подробная информация о произошедшем, стало ясно, что ее подозрения — «абсолютный бред». «Когда у человека возникает паранойя, у него возникают логические подтверждения этой паранойи. Абсолютно удивительно, что паранойя, как только она возникает, она страшно логична. Жизнь тем и отличается от паранойи, что она нелогична», — заключила Латынина. Напомним, колонка Латыниной появилась на сайте «Новой газеты» утром в пятницу. Текст начинался словами «Я не ракетчик. Я филолог», за которыми следовали несколько вопросов «филолога» ракетчикам и министру обороны. В частности, журналистка интересовалась, почему метеорит летел как будто с одного полигона на другой и почему в его поисках участвует «такое фантастическое количество служивых». «Новая газета» удалила колонку с сайта вечером того же дня. Как пояснили в редакции, это было сделано по просьбе автора «в связи с поступившей новой информацией». Метеоритный дождь прошел над Уралом утром 15 февраля. По некоторым данным, мощность взрыва метеорита весом до 10 тысяч тонн при входе в атмосферу составила до 500 килотонн. От взрывной волны пострадали более тысячи человек, из них примерно 50 попали в больницы. Челябинской области нанесен ущерб на сумму около миллиарда рублей.	0
Значительная часть журналистов британского медиахолдинга «Би-Би-Си» вышли на суточную забастовку из-за предстоящего сокращения штата компании. Об этом сообщает BBC News. Причиной конфликта стало отсутствие соглашения по 30 сотрудникам, которых пока не смогли перевести на другую работу. Журналисты устроили многочисленные пикеты около здания компании в Лондоне. Сотрудники «Би-Би-Си» были поддержаны Национальным союзом журналистов (NUJ) Великобритании. Ежедневная новостная программа Today на Radio 4 также не вышла в соответствии с расписанием в 6:00 по местному времени. Вместо нее телерадиокорпорация транслировала другие передачи. Согласно заявлению представителей «Би-Би-Си», компания разочарована действиями профсоюзов. Как пишет The Daily Telegraph, «Би-Би-Си» собирается предпринять все возможные усилия для обеспечения увольняемых сотрудников работой. В свою очередь, члены Национального союза журналистов считают, что компания таких усилий не прикладывает, что она и продемонстрировала в переговорном процессе. В NUJ утверждают, что «Би-Би-Си» жертвует множеством талантливых и опытных сотрудников, но при этом набирает новых через внешние структуры.	0
Холдинг ВГТРК объявил о выходе из состава фонда «Академия российского телевидения» («АРТ»), организатора премии ТЭФИ. Об этом 18 февраля сообщают «Вести», входящие в ВГТРК. Выход из фонда в холдинге объяснили тем, что «Академия» перестала объединять телесообщество и «превратилась в площадку телераздора». Кроме того, отметили в ВГТРК , выход из числа организаторов ТЭФИ холдинга «Газпром-медиа» в 2007 году «ставило результаты работы 'Академии' под большой вопрос». В ВГТРК подчеркнули, что де-факто холдинг не участвовал в деятельности «АРТ» последние шесть лет, а нынешнее решение является юридическим подтверждением сложившейся ситуации. Оно было озвучено накануне заседания учредителей фонда. Вместе с тем, холдинг указал на необходимость создания профессионального телевизионного конкурса, объединяющего всех участников отрасли. Для этого ВГТРК предлагает другим телекомпаниям обсудить новые формы организации телевизионного экспертного сообщества. В состав ВГТРК входят телеканалы «Россия 1», «Россия 2», «Россия 24», «Россия К» («Культура»), «РТР-Планета» и детский канал «Карусель», а также радиокомпании «Маяк», «Радио России», «Вести ФМ», «Культура» и «Юность». «Россия 1» и «Культура» входят в число учредителей фонда «АРТ» (при этом среди них нет ни канала НТВ, ни ТНТ). «Академия российского телевидения» была учреждена в 1994 году, которая с 1995 года проводит конкурс ТЭФИ. Первая премия «За особый вклад в развитие телевидения» была посмертно вручена журналисту и первому гендиректору ОРТ Владиславу Листьеву, убитому за два месяца до церемонии. Прием работ для ТЭФИ-2012 проходит с 9 по 22 февраля 2013 года.	0
Англоязычный сайт телекомпании Russia Today подвергся самой мощной DDoS-атаке за всю историю своего существования. Об этом сообщается в поступившем в «Ленту.ру» пресс-релизе. Атака на сайт началась днем в воскресенье, 17 февраля. Из-за большого количества запросов, поступивших от злоумышленников, ресурс оказался недоступен для остальных пользователей. Восстановить работу сайта удалось к 22 часам по московскому времени, спустя шесть часов с начала атаки. В сообщении телекомпании отмечается, что ответственность за DDoS-атаку пока никто на себя не взял. Russia Today указывает на то, что атака была «дорогостоящей» и «хорошо спланированной». Из этого компания делает вывод, что ее осуществили профессионалы. Причины атаки пока неизвестны. Последний раз сайт Russia Today подвергался DDoS-атаке ровно полгода назад, 17 августа 2012 года. Ответственность за нее взяла хакерская группа Antileaks, ранее атаковавшая сайт Wikileaks. Также жертвой хакеров становился сервис видеотрансляций Bambuser, предположительно, за трансляции с участием основателя Wikileaks Джулиана Ассанжа. Телеканал Russia Today, финансируемый из российского бюджета, был запущен в декабре 2005 года. С апреля по июль 2012 года в эфире канала выходила программа Джулиана Ассанжа World Tomorrow, в рамках которой основатель Wikileaks брал интервью у различных деятелей (в частности, у лидера военизированной шиитской организации «Хизбалла»).	0
Телекомпания «НТВ-Плюс» приобрела эксклюзивные права на показ матчей английской футбольной премьер-лиги (АПЛ) на ближайшие три сезона. Об этом сообщается в пресс-релизе компании «Газпром-Медиа Холдинг», поступившем в «Ленту.ру». Ранее игры АПЛ транслировал телеканал «Россия-2», входящий в ВГТРК. «НТВ-Плюс» будет показывать матчи АПЛ в сезонах 2013/2014, 2014/2015 и 2015/2016. Тендер на продажу телевизионных прав был объявлен в середине декабря 2012 года. Как уточняется в пресс-релизе, руководство английской премьер-лиги приняло решение о заключении контракта с «НТВ-Плюс», исходя из опыта телекомпании в трансляциях крупнейших европейских чемпионатов и из финансового аспекта. За один сезон «НТВ-Плюс» собирается транслировать до 220 матчей чемпионата Англии. Игры будут показаны на спортивных каналах «НТВ-Плюс», а также на сайтах www.ntvplus.ru и www.ntvplus.tv. Кроме того, еженедельно в эфир будут выходить обзорные и аналитические передачи, посвященные премьер-лиге. Телеканал «НТВ-Плюс Спорт» начал показывать игры английского чемпионата уже в 1997 году, через год после запуска. К 2010 году в эфир телекомпании выходило до восьми матчей в одну игровую неделю. Летом 2010 года медиахолдинг ВГТРК перекупил права на показ матчей АПЛ. Контракт был заключен на три сезона.	0
Старший сын Майкла Джексона, 16-летний Принс, дебютировал на телевидении. Он выступил приглашенным корреспондентом новостей о шоу-бизнесе Entertainment Tonight. Об этом сообщается на сайте передачи. Принс Джексон взял интервью у создателей фильма «Оз: Великий и Ужасный»: режиссера Сэма Рэйми и актеров Джеймса Франко и Зака Браффа. Как сказано на сайте, эпизоды с интервью Принса будут выходить в эфир в течение текущей недели. Идея пригласить сына Майкла Джексона пришла в голову одной из ведущих "Entertainment Tonight", Брук Андерсон (Brooke Anderson). «Я подумала, что это будет здорово. Его отец снимался в "Визе" (мюзикл 1978 года по сказке "Удивительный волшебник из страны Оз" — ред.), и он сам хочет стать продюсером и режиссером», — заявила ведущая газете Los Angeles Times. Как отметила Андерсон, для своих 16 лет Принс достаточно умен и рассудителен. Он ей пояснил, что стал таким благодаря правильному воспитанию. Андерсон заявила, что Принса будут время от времени приглашать на работу. Как сказано на сайте, в следующий раз сын Майкла Джексона хотел бы взять интервью у режиссера Питера Джексона. «Мне очень нравятся его фильмы. "Властелин колец", "Хоббит", "Кинг Конг"», — цитируют Принса. Передача Entertainment Tonight выходит с 1981 года. В США ее показывают по CBS, также она транслируется на разных каналах в Канаде, Великобритании, Автстралии, Франции и других странах. Помимо Принса, у Майкла Джексона еще двое детей: 14-летняя дочь Пэрис и 10-летний сын Принс II. В августе 2012 года стало известно, что все трое озвучат английскую версию одного из азиатских мультфильмов.	0
Компания «Би-Би-Си» извинилась за песню «Hey Joe» в исполнении Джими Хендрикса, которую поставили в эфир радиостанции BBC 6 Music сразу после новостного сюжета о паролимпийце Оскаре Писториусе. Об этом сообщает The New Musical Express. Герой песни, Джо, убивает свою неверную жену, в то время как Писториусу предъявили обвинение в убийстве своей девушки. Инцидент произошел в эфире радиостанции BBC 6 Music утром 19 февраля. Песню Хендрикса поставили сразу после выпуска новостей, в котором рассказывалось о ходе суда над арестованным Писториусом. В песне, в частности, есть такие строки: «Эй Джо, куда это ты направляешься с оружием в руке? — Я собираюсь пристрелить свою старушку, знаешь, ведь я поймал ее с другим мужиком». Песня «Hey Joe» была написана музыкантом Билли Робертсом, однако по-настоящему известной она стала именно в исполнении Хендрикса. Сразу после выхода песни в эфир ведущий радиостанции принес извинения слушателям. Позже с официальным обращением выступили и представители «Би-Би-Си»: «Учитывая характер новостного сюжета, мы приносим извинения за любую обиду, которую мы могли нанести кому-либо сходством сюжета песни "Hey Joe" с новостями». Подруга Оскара Писториуса — 29-летняя Рева Стенкамп — погибла в ночь на 14 февраля в доме своего молодого человека. Писториус был арестован, а на суде ему предъявили обвинение в предумышленном убийстве. Спортсмен признался в убийстве девушки, однако заявил, что сделал это по ошибке. По его словам, он принял Стенкамп, якобы проникшую в его дом для подготовки сюрприза ко Дню святого Валентина, за грабителя и застрелил ее. Он заявил, что не склонен к насилию и не собирается нарушать общественный порядок в случае освобождения. 20 февраля суд в Претории, столице ЮАР, должен решить, отпустить ли Оскара Писториуса под залог. 26-летний Оскар Писториус, уроженец ЮАР, является шестикратным чемпионом Паралимпийских игр, участником Олимпиады-2012 в Лондоне. В детстве у Писториуса были ампутированы обе ноги, он передвигается на специальных протезах. Он также принимает участие в обычных легкоатлетических соревнованиях наравне с другими спортсменами.	0
Ведущий телепередачи «Человек и закон» Алексей Пиманов запустил интернет-СМИ «Человек онлайн». Об этом сообщается в пресс-релизе, поступившем в «Ленту.ру». Портал находится по адресу chelovek-online.ru. На сайте будут публиковаться новости и аналитические статьи на актуальные темы. Портал пока что делится всего на два тематических раздела: «Закон» и «Здоровье». Раздел «Здоровье» курируется Еленой Малышевой, которая ведет на Первом канале передачи «Здоровье» и «Жить здорово!». К марту на сайте также появятся разделы об отдыхе и образовании. Как объяснил «Ленте.ру» пресс-секретарь проекта Сергей Девятов, «Человек онлайн» планирует охватить все важнейшие сферы человеческой жизни. Помимо новостных материалов, на сайте публикуется справочная информация на соответствующие тематики, а также видеоматериалы. Кроме того, в разделе «Здоровье» представлен медицинский 3D-справочник об устройстве человеческого тела и способах лечения. Сайт также собираются использовать как способ связи со зрителями программ «Человек и закон» и «Здоровье». Планируется, что аудитория портала в первые полгода работы достигнет 800 тысяч посетителей в месяц, а через год — 1,5-2 миллионов посетителей. «Сегодня в Рунете огромное количество онлайн-СМИ, при этом доверие к публикуемой в них информации весьма низкое, — прокомментировал Алексей Пиманов запуск своего портала. — Мы накопили большой опыт в создании материалов, которым наши зрители могут доверять». Алексей Пиманов ведет авторскую программу «Человек и закон» с 1996 года. Кроме того, он является автором и продюсером ряда художественных и документальных фильмов. Помимо журналистской, Пиманов занимается и политической деятельностью. Он представляет в Совете Федерации республику Тыва, и входит в Верховный Хурал (парламент) республики от партии «Единая Россия».	0
